DOI,Title,Authors,Journal,Year,Abstract,LitmapsId,Cited By,References,PubMedId,Tags
10.3390/su12093893,An Institutional Approach to Digitalization in Sustainability-Oriented Infrastructure Projects: The Limits of the Building Information Model,"Ermal Hetemi, Joaquín B. Ordieres Meré, Cali Nuur",Sustainability,2020,"The transport sector accounts for a large share of global Co2 emissions. To mitigate the impact of climate change, several sustainability-oriented large-scale infrastructure projects such as electric road systems and expanding rail systems have recently been on the policy agenda. A parallel development that is expected to accelerate the transition of the transport sector is digitalization, which, although ongoing for many decades, has recently been augmented by concepts such as artificial intelligence (AI) and smart city technologies. The integration of these digitalization tools at the organizational level poses not only opportunities but also some challenges for the actors involved in infrastructure projects. An approach that is currently promoted in the infrastructure sector is the Building Information Model (BIM), which is a decision-making instrument that leverages various digitalization tools and applications. However, although the economic implications of BIM are widely discussed in the literature, the (inter-) organizational dynamics involving multiple actors in infrastructure projects are not fully grasped. Large infrastructure projects are sociotechnical endeavors embedded in complex institutional frames; hence the institutional norms, practices and logics in them are significant. Responding to this, this paper adopted an institutional analysis and put the BIM approach in the (inter-) organizational context in infrastructure delivery. Drawing on empirical data from three organizations in infrastructure delivery in Spain, this paper analyzed the tensions among actors during BIM adoption and implementation.",191893814,36,78,,NUS - Xu
10.1061/(asce)me.1943-5479.0000972,"Integrated Approaches to Design for Manufacture and Assembly: A Case Study of Huoshenshan Hospital to Combat COVID-19 in Wuhan, China","T. Tan, G. Mills, Jiqiang Hu, E. Papadonikolaki",(missing journal),2021,"AbstractRapid deployment of modular hospital facilities has become an essential action in the COVID-19 response. Design for manufacture and assembly (DfMA) has played a significant role, with gover...",21085507,36,84,,NUS - Xu
10.1016/j.jclepro.2023.137888,Life cycle environmental and cost assessment of prefabricated components manufacture,"Ziyue Cheng, Tianzuo Zhang, Xinying Zhou, Ziheng Li, Yuke Jia, Ke Ren, Tianshu Xu, Changting Li, Jinglan Hong",Journal of Cleaner Production,2023,(missing abstract),262747529,36,46,,NUS - Xu
10.1080/09613218.2022.2136130,Developing a readiness model and a self-assessment tool for adopting digital technologies in construction organizations,"Xichen Chen, A. Chang-Richards, F. Ling, T. Yiu, A. Pelosi, Nan Yang",Building Research &amp; Information,2022,"ABSTRACT Despite the benefits of digital technologies (DT) to enhance the performance of the construction industry, the implementation of DT in construction practice has lagged behind. Existing studies have extensively investigated the readiness of single DT, but with limited types of DT and a lack of practicability for construction practitioners. Based on a questionnaire survey, we developed a readiness model and a self-assessment tool for assessing DT readiness for construction companies. Among the 15 indicators of DT readiness surveyed, ‘organizational culture’, ‘leadership and top management support’ and ‘top management’s perception’ were identified as the three most critical indicators. Using factor analysis and fuzzy synthetic evaluation approaches, the readiness model incorporates 15 critical indicators within two groups, quantified weightings, membership functions and criticality indices. The self-assessment tool was developed and validated to assess DT readiness for construction companies based on objective weightings, pinpointing where changes are needed in response to technological disruptions and digitalization transformation. This study incorporates both individual and organizational indicators in a novel organizational DT readiness model and provides a self-assessment tool for construction organizations when adopting multiple DT. The research outcomes can assist the decision-making resources for construction companies to plan and monitor their DT adoption process.",251300527,36,106,,NUS - Xu
10.1061/(asce)co.1943-7862.0002427,Sensor-Integrated Hybrid Blockchain System for Supply Chain Coordination in Volumetric Modular Construction,"Dongmin Lee, Leyang Wen, Jin Ouk Choi, Sanghyun Lee",Journal of construction engineering and management,2023,(missing abstract),252819120,36,38,,NUS - Xu
10.1061/(asce)co.1943-7862.0002270,Identifying Effective Collaborative Behaviors in Building Information Modeling–Enabled Construction Projects,"Guangchong Chen, Jiayu Chen, Yuchun Tang, Qiming Li, Xiaowei Luo",Journal of construction engineering and management,2022,(missing abstract),30587870,35,37,,NUS - Xu
10.3390/buildings12060794,DfMA for a Better Industrialised Building System,"Mohammed Izrai Abd Razak, M. A. Khoiry, W. H. Wan Badaruzzaman, A. H. Hussain",Buildings,2022,"To improve the performance of the construction industry, innovative methods were introduced to make them better. Industrialised building systems (IBS) and prefabrication construction are the popular methods used and studied. However, these methods are still unable to meet the demands of the stakeholders. Design for manufacturing and assembly (DfMA) is a design principle that is seen as capable of improving the situation. The uptake of DfMA in the construction industry needs to be analysed to obtain a better picture of the existing condition of the method and its manner of implementation it going forward, but there are still too few studies performed on this topic. This paper gathers relevant articles from the previous studies on DfMA. With the available data, the main benefits, hindrance factors, and enabling factors for DfMA uptake in the construction industry were identified in this study. The authors also identified the research trend among the research themes and the benefits of building information modelling (BIM) integration with DfMA. By synthesising the information from previous studies, a conceptual framework was developed. Knowledge gaps and future potential research topics are also discussed in this paper, forming a simple research framework for future effort guidance. With a suitable strategy and guidelines, the application of DfMA could improve the performance of the construction industry in Malaysia and other places with similar construction environments and approaches.",229811521,35,82,,NUS - Xu
10.1016/j.autcon.2023.104841,Construction cost management using blockchain and encryption,"Jack C. P. Cheng, Hao Liu, V. Gan, Moumita Das, Xingyu Tao, S. Zhou",Automation in Construction,2023,(missing abstract),263979298,35,56,,NUS - Xu
10.1016/j.resconrec.2019.104674,Is the private sector more efficient? Big data analytics of construction waste management sectoral efficiency,"Jinying Xu, Weisheng Lu, Meng Ye, Fan Xue, Xiaoling Zhang, Billy Fook Pui Lee",Resources Conservation and Recycling,2020,(missing abstract),85977308,35,27,,"NUS - XU Jinying, NUS - Xu"
10.1016/j.jii.2023.100455,Ensuring construction material provenance using Internet of Things and blockchain: Learning from the food industry,"Jinying Xu, Jinfeng Lou, Weisheng Lu, Liupengfei Wu, Chen Chen",Journal of Industrial Information Integration,2023,(missing abstract),255544887,35,31,,"NUS - XU Jinying, NUS - Xu"
10.3390/buildings10100170,Decision Support in Building Construction: A Systematic Review of Methods and Application Areas,"C. Marcher, Andrea Giusti, D. Matt",Buildings,2020,"Decision making is a relevant task in the building construction sector, and various systems and methods for decision support are emerging. By means of a systematic literature review, this article identifies the methods for decision making in building construction and the lifecycle phases for which decision support systems are proposed. The selected articles are analyzed and grouped according to the adopted decision-making methods and the defined lifecycle phases. The findings show that multiple criteria decision analysis is the most used method for decision support in building construction and that the construction phase is the most addressed phase within the relevant existing works. The findings related to the construction phase are further refined by grouping the articles into application areas and by reviewing in detail the proposed methods therein. The scarce availability of data and project cases is identified as the most common barrier for the successful development and implementation of decision support systems in the building construction sector. This work provides a basis for scientists and practitioners for identifying suitable methods for decision-making support in a specific lifecycle phase of a building.",5941858,34,132,,NUS - Xu
10.1016/j.autcon.2022.104149,Dynamic networks for resilience-driven management of infrastructure projects,"Ahmed Gondia, Mohamed Ezzeldin, Wael El-Dakhakhni",Automation in Construction,2022,(missing abstract),224366957,34,52,,NUS - Xu
10.1016/j.autcon.2023.105135,Critical success factors for implementing blockchain technology in construction,"Weihao Sun, M. Antwi-Afari, Imran Mehmood, S. Anwer, Waleed Umer",Automation in Construction,2023,(missing abstract),266239955,34,125,,NUS - Xu
10.1016/j.jclepro.2022.133706,Collaborative mechanism for promoting the cross-regional management of construction and demolition waste,"Ling-Ling He, Hongping Yuan, Huanyu Wu, Ling-Ling He, Hongping Yuan, Huanyu Wu",Journal of Cleaner Production,2022,(missing abstract),243773050,34,61,,NUS - Xu
10.1108/sasbe-09-2022-0192,Major opportunities of digital twins for smart buildings: a scientometric and content analysis,"F. A. Ghansah, Weisheng Lu",Smart and Sustainable Built Environment,2023,"PurposeDigital twins provide enormous opportunities for smart buildings. However, an up-to-date intellectual landscape to understand and identify the major opportunities of digital twins for smart buildings is still not enough. This study, therefore, performs an up-to-date comprehensive literature review to identify the major opportunities of digital twins for smart buildings.Design/methodology/approachScientometric and content analysis are utilised to comprehensively evaluate the intellectual landscape of the general knowledge of digital twins for smart buildings.FindingsThe study uncovered 24 opportunities that were further categorised into four major opportunities: efficient building performance (smart “building” environment), efficient building process (smart construction site environment), information efficiency and effective user interactions. The study further identified the limitations of the existing studies and made recommendations for future research in the methodology adopted and the research domain. Five research domains were considered for future research, namely “real-time data acquisition, processing and storage”, “security and privacy issues”, “standardised and domain modelling”, “collaboration between the building industry and the digital twin developers” and “skilled workforce to enable a seamless transition from theory to practice”.Practical implicationsAll stakeholders, including practitioners, policymakers and researchers in the field of “architecture, engineering, construction and operations” (AECO), may benefit from the findings of this study by gaining an in-depth understanding of the opportunities of digital twins and their implementation in smart buildings in the AECO industry. The limitations and the possible research directions may serve as guidelines for streamlining the practical adoption and implementation of digital twins for smart buildings.Originality/valueThis study adopted scientometric and content analysis to comprehensively assess the intellectual landscape of relevant literature and identify four major opportunities of digital twins for smart building, to which scholars have given limited attention. Finally, a research direction framework is presented to address the identified limitations of existing studies and help envision the ideal state of digital twins for smart buildings.",268043941,33,70,,NUS - Xu
10.1016/j.jclepro.2023.137115,Exploring the adoption of blockchain in modular integrated construction projects: A game theory-based analysis,"Pan Zhang, Haitao Wu, Heng Li, B. Zhong, I. Fung, Lee Yiu Yin Raymond",Journal of Cleaner Production,2023,(missing abstract),258334802,33,76,,NUS - Xu
10.1108/ecam-01-2022-0036,BIM-enabled Kanban system in construction logistics for real-time demand reporting and pull replenishment,"N. Zeng, Xuling Ye, Yan Liu, M. König",Engineering Construction and Architectural Management,2023,"PurposeThe unstable labor productivity and periodic planning method cause barriers to improving construction logistics management. This paper aims to explore a demand-driven mechanism for efficient construction logistics planning to record the material consumption, report the real-time demand and trigger material replenishment from off-site to on-site, which is aided by Building Information Modeling (BIM) and the Kanban technique.Design/methodology/approachThis paper follows the design science research (DSR) principles to propose a system of designing and applying Kanban batch with 4D BIM for construction logistics planning and monitoring. Prototype development with comparative simulation experiments of a river remediation project is conducted to analyze the conventional and Kanban-triggered supply. Two-staged industrial interviews are conducted to guide and evaluate the system design.FindingsThe proposed BIM-enabled Kanban system enables construction managers and suppliers to better set integrated on- and off-site targets, report real-time demands and conduct collaborative planning and monitoring. The simulation results present significant site storage and schedule savings applying the BIM-enabled Kanban system. Feedback and constructive suggestions from practitioners are collected via interviews and analyzed for further development.Originality/valueThis paper brings to the limelight the benefits of implementing BIM-enabled demand-driven replenishment to remove waste from the material flow. This paper combines lean production theory with advanced information technology to solve construction logistics management problems.",254499814,33,57,,NUS - Xu
10.1007/s42768-023-00166-y,"Review of construction and demolition waste management tools and frameworks with the classification, causes, and impacts of the waste","Dewan Sabbir Ahammed Rayhan, I. Bhuiyan",Waste Disposal &amp; Sustainable Energy,2023,(missing abstract),266343455,33,167,,NUS - Xu
10.1108/sasbe-10-2023-0298,"Digital twins for smart building at the facility management stage: a systematic review of enablers, applications and challenges",F. A. Ghansah,Smart and Sustainable Built Environment,2024,"PurposeDespite the opportunities of digital twins (DTs) for smart buildings, limited research has been conducted regarding the facility management stage, and this is explained by the high complexity of accurately representing and modelling the physics behind the DTs process. This study thus organises and consolidates the fragmented literature on DTs implementation for smart buildings at the facility management stage by exploring the enablers, applications and challenges and examining the interrelationships amongst them.Design/methodology/approachA systematic literature review approach is adopted to analyse and synthesise the existing literature relating to the subject topic.FindingsThe study revealed six main categories of enablers of DTs for smart building at the facility management stage, namely perception technologies, network technologies, storage technologies, application technologies, knowledge-building and design processes. Three substantial categories of DTs application for smart buildings were revealed at the facility management stage: efficient operation and service monitoring, efficient building energy management and effective smart building maintenance. Subsequently, the top four major challenges were identified as being “lack of a systematic and comprehensive reference model”, “real-time data integration”, “the complexity and uncertainty nature of real-time data” and “real-time data visualisation”. An integrative framework is finally proposed by examining the interactive relationship amongst the enablers, the applications and the challenges.Practical implicationsThe findings could guide facility managers/engineers to fairly understand the enablers, applications and challenges when DTs are being implemented to improve smart building performance and achieve user satisfaction at the facility management stage.Originality/valueThis study contributes to the knowledge body on DTs by extending the scope of the existing studies to identify the enablers and applications of DTs for smart buildings at the facility management stage and the specific challenges.",271248261,33,106,,NUS - Xu
10.1016/j.eiar.2021.106592,Dynamic game strategies for construction and demolition waste recycling with learning and reference effects,"Qidan Hu, Peiyang Su, Feng Xiong",Environmental impact assessment review,2021,(missing abstract),34085681,33,47,,NUS - Xu
10.3390/su13179591,BIM and DfMA: A Paradigm of New Opportunities,"Sepehr Abrishami, Rocío Martín-Durán",Sustainability,2021,"The main goal of this study is to explore the adoption of a design for manufacturing and assembly (DfMA) and building information management (BIM) approach during the whole lifecycle of assets. This approach aims to tackle issues inherent in the design of traditional construction methods, such as low productivity and quality, poor predictability and building performance, and energy use, through the implementation of a BIM library of off-site components. In recent years, a renewed interest has been directed to the attempt to provide solutions to these urgent problems through the adoption of new advancements in technologies. However, while there are studies focussing on a BIM-DfMA approach, there is a lack of research regarding how this approach should be adopted during the whole lifecycle of the assets. Furthermore, to the best of our knowledge, defining an efficient way of developing a component-based BIM object library has not yet been included in any of the available studies. A mixed methodology approach has been used in this research. A conceptual framework was developed as the result of an extensive literature review to investigate new advancements in the AEC sector. Following the literature review, the framework was tested and validated through a case study based on the production and adoption of a BIM library of off-site components at the design stage of an asset. The architecture, engineering, and construction (AEC) industry has recognised the necessity of a new approach that helps to resolve the well-known issues presented in traditional methods of construction. The conceptual framework and case study proposed presents a valuable new method of construction that support the implementation of a BIM and DfMA approach, highlighting their benefits. This framework has been created using many valuable and reliable sources of information. The result of this research supports the idea of a novel new construction method that focuses on a manufacturing-digital-driven industry, with the use of DfMA in a BIM-integrated approach. This novel method will add significance and be beneficial for a wide range of aspects in the construction sector, contributing to the theoretical and practical domain.",21245087,32,44,,NUS - Xu
10.1061/jmenea.meeng-5366,A Decentralized and Automated Contracting System Using a Blockchain-Enabled Network of Stakeholders in Construction Megaprojects,"Purva Gupta, Kumar Neeraj Jha",Journal of Management in Engineering,2023,"With recent advances in information and communication technologies, trust and collaboration have become imperative in the construction industry. The increasing exchange of digital information and assets without much regard to contractual requirements has resulted in various data corruption, privacy, and security issues escalating to claims and disputes. Hence, there is a need to institute reforms in the existing contracting system to achieve a more efficient, collaborative, and transparent system. However, little research has investigated the digitalization of the contracting process, which continues to be traditional. This study is one of the first to develop a digital and automated contract management system leveraging blockchain technology and smart contracts. Design science research methodology was adopted for the research work. The proposed system aims to achieve the following: (1) a decentralized permissioned network of stakeholders with well-defined roles and approval workflow, (2) automated contract execution based on predefined conditions using smart contracts, and (3) transaction history integrity with time stamps via a blockchain-based secured data structure. To exemplify these points, a use case is presented for implementing blockchain-based contract management in a construction megaproject. A conceptual model was developed illustrating the decentralized network of the key project stakeholders based in a Hyperledger Fabric blockchain environment. The roles and access controls of the stakeholders within the network are defined using the responsibility assignment [responsible, accountable, consulted, and informed (RACI) matrix]. A computable and automated smart contract clause is formulated for the price variation clause used in construction contracts. A prototype of the proposed system was developed and demonstrated to industry experts for evaluation and validation. Positive feedback from the experts concerning the system characteristics and user-friendliness of the prototype showed that it possesses the potential to improve trust and transparency in the existing system. Whereas the decentralized stakeholder network would add trust and accountability to the system, the underlying blockchain data structure would enhance security and traceability by providing an immutable and real-time record of the transactions. The study provides a workable solution that serves as a valuable reference for future research in the field of contract management across multiple sectors. Although the system is shown to be applicable and feasible in this study, it may not be economically viable. It could be optimized in the future through cost–benefit analysis for different projects.",262691225,32,35,,NUS - Xu
10.1016/j.jii.2023.100491,A transformative solution for construction safety: Blockchain-based system for accident information management,"Salar Ahmadisheykhsarmast, Saman Aminbakhsh, Rifat Sonmez, Furkan Uysal",Journal of Industrial Information Integration,2023,(missing abstract),263606565,32,66,,"NUS - Xu, NUS - Xu Jinying - Transition"
10.1080/01446193.2023.2205159,Responses to the COVID-19 pandemic in the construction industry: a literature review of academic research,"Frank Ato Ghansah, Weisheng Lu",Construction Management and Economics,2023,"Over the past 3 years, the global construction sector has been severely affected by the noxious coronavirus (COVID-19) pandemic. Visionary construction stakeholders, including governments, practitioners, and academia, all have been actively devising strategies to deal with the crisis caused by the pandemic. Despite the rich contributions by academia, an in-depth review of their research works to understand how the pandemic has been handled to position the construction industry for post-pandemic actions and future pandemics is hitherto lacking. Hence, an up-to-date literature review is conducted in this study to better understand this terra incognita. It does so by adopting a six-step thematic analysis of 159 empirical peer-reviewed research articles in relation to COVID-19 on construction. The review discovered a growing research interest from different countries from 2020 to 2022. The existing studies can be put under four major topics, namely the COVID-19 impacts, challenges and opportunities, responding strategies, and post-COVID-19 interventions. A framework consisting of four categories of responding strategies, namely vaccination, personal responsibility of workers, government-instructional practices, and organisation-based approaches, is proposed through the lens of the socio-technical system theory to handle the pandemic crisis in construction. Limitations of the existing studies were further identified. Four pertinent research directions were finally proposed: building upon and testing the proposed COVID-19 response framework, adoption of more advanced innovative strategies to increase productivity amid pandemics and survive the risk of future pandemics, beyond the technological response to COVID-19 in construction, and post-pandemic view of the construction industry. This study contributes to the knowledge body by providing a candid evaluation of the knowledge contributed by academia to deal with the risks of future pandemics in the global construction industry. © 2023 Informa UK Limited, trading as Taylor & Francis Group.",260457928,32,39,,"NUS - Xu, NUS - Xu Jinying - Transition"
