DOI,Title,Authors,Journal,Year,Abstract,LitmapsId,Cited By,References,PubMedId,Tags
10.1108/sasbe-05-2023-0111,Leveraging digital technologies for circular economy in construction industry: a way forward,"Navodana Rodrigo, Hossein Omrany, Ruidong Chang, Jian Zuo",Smart and Sustainable Built Environment,2024,"Purpose This study aims to investigate the literature related to the use of digital technologies for promoting circular economy (CE) in the construction industry. Design/methodology/approach A comprehensive approach was adopted, involving bibliometric analysis, text-mining analysis and content analysis to meet three objectives (1) to unveil the evolutionary progress of the field, (2) to identify the key research themes in the field and (3) to identify challenges hindering the implementation of digital technologies for CE. Findings A total of 365 publications was analysed. The results revealed eight key digital technologies categorised into two main clusters including “digitalisation and advanced technologies” and “sustainable construction technologies”. The former involved technologies, namely machine learning, artificial intelligence, deep learning, big data analytics and object detection and computer vision that were used for (1) forecasting construction and demolition (C&D) waste generation, (2) waste identification and classification and (3) computer vision for waste management. The latter included technologies such as Internet of Things (IoT), blockchain and building information modelling (BIM) that help optimise resource use, enhance transparency and sustainability practices in the industry. Overall, these technologies show great potential for improving waste management and enabling CE in construction. Originality/value This research employs a holistic approach to provide a status-quo understanding of the digital technologies that can be utilised to support the implementation of CE in construction. Further, this study underlines the key challenges associated with adopting digital technologies, whilst also offering opportunities for future improvement of the field.",291693398,65,108,,NUS - Xu
10.1016/j.jclepro.2023.140369,A data-driven robust optimization in viable supply chain network design by considering Open Innovation and Blockchain Technology,"Reza Lotfi, Reza Hazrati, Sina Aghakhani, Mohamad Afshar, Mohsen Amra, Sadia Samar Ali",Journal of Cleaner Production,2023,(missing abstract),268097449,65,53,,NUS - Xu
10.1016/j.scs.2023.104400,Benchmarking the sustainability of concrete and steel modular construction for buildings in urban development,"Wei Pan, Zhiqian Zhang",Sustainable Cities and Society,2023,(missing abstract),232247908,65,46,,NUS - Xu
10.1016/j.autcon.2021.103917,Integrating disruptive technologies with facilities management: A literature review and future research directions,"Marco Marocco, Ilaria Garofolo",Automation in Construction,2021,(missing abstract),169404143,64,108,,NUS - Xu
10.1016/j.tre.2023.103014,Impacts of blockchain-based digital transition on cold supply chains with a third-party logistics service provider,"Xuefeng Zhang, Zhe Li, Guo Li",Transportation Research Part E: Logistics and Transportation Review,2023,(missing abstract),254333297,64,54,,NUS - Xu
10.1016/j.autcon.2020.103388,Big data for Design Options Repository: Towards a DFMA approach for offsite construction,"Abdul-Quayyum Gbadamosi, Lukumon O. Oyedele, Abdul–Majeed Mahamadu, Habeeb. Kusimo, Muhammad Bilal, Juan Manuel Davila Delgado, Naimah Muhammed-yakubu",Automation in Construction,2020,(missing abstract),218190222,64,68,,NUS - Xu
10.1016/j.jobe.2023.106788,"Integrated practices in the Architecture, Engineering, and Construction industry: Current scope and pathway towards Industry 5.0","Ayodele Emmanuel Ikudayisi, Albert P.C. Chan, Amos Darko, Yomi, M.D. Adedeji",Journal of Building Engineering,2023,(missing abstract),261642714,64,93,,NUS - Xu
10.1109/jstars.2021.3068796,A Survey of Applications With Combined BIM and 3D Laser Scanning in the Life Cycle of Buildings,"Jingbin Liu, Dong Xu, Juha Hyyppä, Yifan Liang",IEEE Journal of Selected Topics in Applied Earth Observations and Remote Sensing,2021,"The integration of building information model (BIM) with point cloud from 3-D laser scanner provides powerful assistance in a variety of applications in the life cycle of building. However, the adoption of BIM and 3-D laser scanning for applications in the whole life cycle of buildings has yet to be satisfactorily reviewed. There is a need to understand the current situation of applications with BIM and 3-D laser scanning and their combined methods. The authors summarized combined methods of BIM and 3-D laser scanning at first. Then. the work presented in this article provides summarization of applications in the life cycle of building. In addition, the impact of emerging technologies on applications also be discussed. In this review, articles were limited to those published over the last decade. Two patterns in the approach to integrate BIM and 3-D laser scanning are reviewed. Several domains of application namely construction progress tracking, building components quality control, construction site safety, structural health monitoring, rescue after the disaster, energy modeling and management and modeling for exist building are looked back. According to occurred time of these applications, this article divides them into two classes: applications in construction period and applications in maintenance period. Based on the observed limitations in the reviewed papers, the authors conclude some potential future research trend for these applications based emerging technology at the same time.",123198420,63,96,,NUS - Xu
10.3390/buildings12010040,A Systematic Review on Supply Chain Management in Prefabricated House-Building Research,"Rehan Masood, James B.P. Lim, Vicente A. González, Krishanu Roy, Khurram Iqbal Ahmad Khan",(missing journal),2022,"Prefabricated house-building companies, as suppliers or supply chains, which use manufacturing as a business approach towards industrialization, struggle to implement principles and optimal practices driven from well-established and validated theories in operational research. Supply chain management has a mature body of knowledge that has been widely adopted by research on offsite construction to improve its performance at an organisational level. However, there is no comprehensive review available in the literature for supply chain management theory within prefabricated house building research from the perspective of suppliers. In this study, a systematic review was conducted on the available literature on supply chain management within prefabricated house-building research. Initially, qualitative analysis was performed to identify the key themes. Later, quantitative analyses were applied to validate the overlapping themes and keywords. Further, key trends related to focus, methods and theories or frameworks were reported. The findings were discussed in the context of recent developments in all principal component bodies of supply chain management for future work. This study also provides a brief guide for potential future review studies to explore interdisciplinary intervention within the offsite stream.",92469374,62,124,,NUS - Xu
10.1016/j.jclepro.2020.124540,A four-quadrant conceptual framework for analyzing extended producer responsibility in offshore prefabrication construction.,"Jinying Xu, Meng Ye, Weisheng Lu, Zhikang Bao, Chris Webster",Journal of Cleaner Production,2021,(missing abstract),224323641,60,74,,"NUS - XU Jinying, NUS - Xu"
10.3390/buildings12081205,Green Building Construction: A Systematic Review of BIM Utilization,"Yuzhuo Cao, S. Kamaruzzaman, N. M. Aziz",Buildings,2022,"As a multi-function method, Building Information Modeling (BIM) can assist construction organizations in improving their project’s quality, optimize collaboration efficiency, and reduce construction periods and expenditure. Given the distinguished contributions of BIM utilization, there is a trend that BIM has significant potential to be utilized in the construction phase of green buildings. Compared with traditional buildings, green buildings have more stringent requirements, including environmental protection, saving energy, and residents’ comfort. Although BIM is deemed an effective method to achieve the abovementioned requirements in the construction process of green buildings, there are few systematic reviews that explore the capabilities of BIM in the construction phase of green buildings. This has hindered the utilization of BIM in the construction of green buildings. To bridge this research gap and review the latest BIM capabilities, this study was developed to perform a systematic review of the BIM capabilities in the construction phase of green buildings. In this systematic review, the PRISMA protocol has been used as the primary procedure for article screening and review. The entire systematic review was performed from January 2022 to April 2022. In this process, 165 articles were included, reviewed, and discussed. Web of Science (WoS) and Scopus were adopted as the databases. Through this systematic review, it can be identified that BIM capabilities have significant advantages in project quality improvement, lifecycle data storage and management, collaboration optimization, planning, and schedule management optimization in the construction phase of green buildings. Through the discussion, it can be concluded that BIM utilization can be adopted from the pre-construction phase to the post-construction stage in the green building construction process. Besides these, the barriers to BIM utilization in the green building construction phase are also revealed in the discussion section, including the non-uniform data format, insufficient interactivity, ambiguous ownership, insufficient BIM training, and hesitation toward BIM adoption. Moreover, the challenges and future directions of BIM utilization in green building construction are identified. The findings of this study can facilitate construction personnel to be acquainted with BIM capabilities in the construction of green buildings to promote the utilization and optimization of BIM capabilities in the green building construction process.",235517307,60,177,,NUS - Xu
10.1016/j.ssci.2022.105852,Using BIM in the safety risk management of modular construction,"Mikela Chatzimichailidou, Yue Ma",Safety Science,2022,(missing abstract),276206876,60,3,,NUS - Xu
10.1016/j.techsoc.2022.102010,Developing a human-organization-technology fit model for information technology adoption in organizations,"Jinying Xu, Weisheng Lu, Jinying Xu, Weisheng Lu",Technology in Society,2022,(missing abstract),184442154,60,69,,"NUS - XU Jinying, NUS - Xu"
10.1016/j.jobe.2023.107598,Digital twin-enabled prefabrication supply chain for smart construction and carbon emissions evaluation in building projects,"S. K. Yevu, E. Owusu, A. Chan, S. Sepasgozar, V. Kamat",Journal of Building Engineering,2023,(missing abstract),265490554,59,67,,NUS - Xu
10.3390/su15021275,An In-Depth Survey Demystifying the Internet of Things (IoT) in the Construction Industry: Unfolding New Dimensions,"K. Khurshid, A. Danish, M. U. Salim, Muhammed Bayram, T. Ozbakkaloglu, Mohammed Mosaberpanah",Sustainability,2023,"In this digital era, many industries have widely adopted the Internet of Things (IoT), yet its implementation in the construction industry is relatively limited. Integration of Construction 4.0 drivers, such as business information modeling (BIM), procurement, construction safety, and structural health monitoring (SHM), with IoT devices, provides an effective framework for applications to enhance construction and operational efficiencies. IoT and Construction 4.0 driver integration research, however, is still in its infancy. It is necessary to understand the present state of IoT adoption in the Construction 4.0 context. This paper presented a comprehensive review to identify the IoT adoption status in the Construction 4.0 areas. Furthermore, this work highlighted the potential roadblocks to IoT’s seamless adoption that are unique to the areas of Construction 4.0 in developing countries. Altogether, 257 research articles were reviewed to present the current state of IoT adoption in developed and developing countries, as well as the topmost barriers encountered in integrating IoT with the key Construction 4.0 drivers. This study aimed to provide a reference for construction managers to observe challenges, professionals to explore the hybridization possibilities of IoT in the context of Construction 4.0, and laymen to understand the high-level scientific research that underpins IoT in the construction industry.",252509509,58,110,,NUS - Xu
10.1016/j.jclepro.2022.130883,The technology-environment relationship revisited: Evidence from the impact of prefabrication on reducing construction waste,"Ruibo Hu, Ke Chen, Weili Fang, Linzi Zheng, Jinying Xu",Journal of Cleaner Production,2022,(missing abstract),26862157,58,75,,"NUS - XU Jinying, NUS - Xu"
10.3390/buildings13040976,Timber Construction as a Solution to Climate Change: A Systematic Literature Review,"L. Tupėnaitė, Loreta Kanapeckiene, Jurga Naimaviciene, A. Kaklauskas, T. Gečys",Buildings,2023,"The built environment significantly contributes to climate change. There is pressure on the construction industry to find and use alternative sustainable environmentally friendly building materials to reduce the climate impact. Timber is increasingly being considered in the literature and used as a viable alternative for steel and concrete in both residential and non-residential building projects as it is a renewable material and has multiple benefits for reducing carbon (CO2) emissions and consequently climate change. This study aims to research the benefits of sustainable timber construction in terms of climate change. To achieve this aim, a systematic literature review was performed based on the research conducted between 1998 and 2022. For this purpose, research papers were searched from the Web of Science database and screened by applying a combination of keywords and the criteria for academic publication selection, including climate change, timber or wooden building, renewable material, sustainable material, carbon sink, carbon reduction, embodied energy, lifecycle assessment, and the circular economy. Further, a quantitative analysis of publications was performed using a science mapping approach, and qualitative content analysis was then conducted in three areas of research: timber as a sustainable construction material, the carbon storage of and reduction in GHG/CO2 emissions, and the circular economy. Research trends, general findings, and knowledge gaps were identified, and future research directions were indicated. The literature review proves that timber construction is a potential solution to reduce climate change.",256916457,57,156,,NUS - Xu
10.1016/j.scs.2022.104259,Resilience in the built environment: key characteristics for solutions to multiple crises,"Raúl Castaño-Rosa, Sofie Pelsmakers, Heini Järventausta, Jenni Poutanen, Lassi Tähtinen, Anahita Rashidfarokhi, Saija Toivonen",Sustainable cities and society,2022,(missing abstract),251647613,57,183,,NUS - Xu
10.3390/fi14070216,"Internet of Things and Blockchain Integration: Security, Privacy, Technical, and Design Challenges","Y. Alzoubi, A. Al-Ahmad, Hasan Kahtan, Ashraf Jaradat",Future Internet,2022,"The Internet of things model enables a world in which all of our everyday devices can be integrated and communicate with each other and their surroundings to gather and share data and simplify task implementation. Such an Internet of things environment would require seamless authentication, data protection, stability, attack resistance, ease of deployment, and self-maintenance, among other things. Blockchain, a technology that was born with the cryptocurrency Bitcoin, may fulfill Internet of things requirements. However, due to the characteristics of both Internet of things devices and Blockchain technology, integrating Blockchain and the Internet of things can cause several challenges. Despite a large number of papers that have been published in the field of Blockchain and the Internet of things, the problems of this combination remain unclear and scattered. Accordingly, this paper aims to provide a comprehensive survey of the challenges related to Blockchain–Internet of things integration by evaluating the related peer-reviewed literature. The paper also discusses some of the recommendations for reducing the effects of these challenges. Moreover, the paper discusses some of the unsolved concerns that must be addressed before the next generation of integrated Blockchain–Internet of things applications can be deployed. Lastly, future trends in the context of Blockchain–Internet of things integration are discussed.",246367785,56,188,,NUS - Xu
10.1016/j.autcon.2022.104677,Automated structural design optimization of steel reinforcement using graph neural network and exploratory genetic algorithms,"Mingkai Li, Yuhan Liu, B. C. Wong, V. Gan, Jack C. P. Cheng",Automation in Construction,2023,(missing abstract),250494020,56,42,,NUS - Xu
10.1016/j.aei.2022.101838,Automated facility inspection using robotics and BIM: A knowledge-driven approach,"Junjie Chen, Weisheng Lu, Yong Fu, Zhiming Dong",Advanced Engineering Informatics,2023,(missing abstract),255218704,55,45,,NUS - Xu
10.3390/vaccines10122026,Predicting Vaccination Intention against COVID-19 Using Theory of Planned Behavior: A Systematic Review and Meta-Analysis,"Yam B. Limbu, R. Gautam, Wencang Zhou",Vaccines,2022,"This study systematically analyzed the literature using the theory of planned behavior (TPB) as a theoretical framework to examine the influence of its constructs on vaccination intention against COVID-19. Quantitative studies were searched in PubMed, CINAHL, Web of Science, and Google Scholar following the PRISMA guidelines. The average rate of COVID-19 vaccination intention was 73.19%, ranging from 31% to 88.86%. Attitude had the strongest association with vaccination intention (r+ = 0.487, 95% CI: 0.368–0.590), followed by subjective norms (r+ = 0.409, 95% CI: 0.300–0.507), and perceived behavioral control (r+ = 0.286, 95% CI: 0.198–0.369). Subgroup analyses showed that the pooled effect sizes of TPB constructs on vaccination intention varied across geographic regions and study populations. Attitude had large effect sizes in Asia, Europe, and Oceania, especially among the adult general population, parents, and patients. Subjective norms had large effect sizes in Asia and Oceania, especially among parents and patients. Perceived behavioral control was the most dominant predictor of vaccination acceptance in Africa among patients. These findings suggest that TPB provides a useful framework for predicting intention to receive a COVID-19 vaccine. Hence, public awareness and educational programs aimed at promoting COVID-19 vaccination intention should consider using TPB as a framework to achieve the goal.",250926074,55,119,,NUS - Xu
10.1007/s42524-022-0247-8,Balancing resilience and efficiency in supply chains: Roles of disruptive technologies under Industry 4.0,"Jingling Xue, Guo Li",Frontiers of Engineering Management,2023,"In the Industry 4.0 era, disruptive technologies such as big data analytics, blockchain, Internet-of-Things, and additive manufacturing have become major forces driving supply chain transformation. Under such circumstances, particular attention should be attached to balancing resilience and efficiency of the supply chain, especially in the presence of more turbulence. In this study, we first summarize the conflicts between supply chain efficiency and supply chain resilience regarding practices and objectives. Then, we discuss the positive effects of disruptive technologies in improving resilience and efficiency. Afterwards, we propose a research agenda that covers both the influence mechanism and trade-off mechanism of these technologies in terms of resilience and efficiency.",254071644,55,35,,NUS - Xu
10.1016/j.jenvman.2023.118823,How construction and demolition waste management has addressed sustainable development goals: Exploring academic and industrial trends.,"Ke Zhang, Ye Qing, Qasim Umer, Fahad Asmi",Journal of Environmental Management,2023,(missing abstract),264831947,54,71,,NUS - Xu
10.1016/j.asej.2023.102362,Exploration of challenges to deployment of blockchain in small construction projects,"Ahsan Waqar, Abdul Hannan Qureshi, Idris Othman, Noha Saad, Marc Azab",Ain Shams Engineering Journal,2023,(missing abstract),263164481,54,59,,NUS - Xu
10.3390/su13169219,DfMA: Towards an Integrated Strategy for a More Productive and Sustainable Construction Industry in Australia,"C. Langston, Weiwei Zhang",Sustainability,2021,"Design for manufacture and assembly (DfMA) is an important part of the future of the construction industry due to the promise of speed of project delivery, quality control, worker safety, and waste minimization onsite via the purposeful design for manufacture and assembly offsite. However, the adoption of DfMA in Australia has been slow. This paper investigates the barriers prohibiting widespread uptake and how digital construction will be a catalyst for improving use on commercial-scale projects. A total of six leading experts were interviewed to elicit their opinions, and seven recent case studies of high-rise modular apartment and hotel buildings constructed by Hickory were cross-referenced as evidence of DfMA capability. The experts suggested that the reasons for slow adoption in Australia were community mindset, government regulations and incentives, planning and building codes, unionization and business politics, finance, and supply chain management. The case studies suggest that compatible building type and transportation distance are also factors. These barriers can be addressed by the clever integration of building information modelling tools with lean construction processes as part of a proposed strategy leading to smarter (more productive) and better (more sustainable) outcomes predicated on growth in digital construction practices. The paper concludes with a proposed framework for change that conceptualizes the ‘ecosystem’ needed to support widespread DfMA in the Australian context, including the paradigm shift from building to manufacturing/assembly, the displacement of workers from onsite to offsite activity, and the expansion of interdisciplinary design and construct collaboration.",117728879,53,65,,NUS - Xu
10.1016/j.techfore.2023.123047,Embracing RAISA in restaurants: Exploring customer attitudes toward robot adoption,"Joanna Santiago, Maria Teresa Borges-Tiago, Flávio Tiago",Technological forecasting & social change,2024,(missing abstract),268550305,51,78,,NUS - Xu
10.3390/su13020620,Extended Producer Responsibility in the Australian Construction Industry,"S. Shooshtarian, T. Maqsood, P. Wong, M. Khalfan, R. Yang",Sustainability,2021,"With the COVID-19 outbreak across the world, policymakers and authorities have realised that they cannot solve the emerging issues using conventional policies and practices. COVID-19 has severely affected many industries, including construction and demolition (C&D) waste management and C&D waste resource recovery sector. Extended Producer Responsibility (EPR) and schemes alike are policy instruments that prevent waste generation and promote a circular economy in the construction industry. These schemes are long adopted in various countries for different waste streams. EPR policy development and implementation, particularly for C&D waste, is still at an early stage in Australia. This study aims to review the Australian regulatory environment and practice to identify barriers and enablers towards successful policy development and implementation of C&D waste-related EPR. This study is based on secondary data that are publicly available. The document analysis was conducted to identify the level of regulatory and other stakeholders support in Australia. Following three rounds of examination of sources and applying multiple selection criteria, 59 different sources were reviewed in total. The results showed that there is widespread support among different stakeholders to develop EPR and expand the existing regulation to other materials. The barriers were cost and time implications for EPR policy establishment and enforcement, diversity of stakeholders involved, construction product lifecycle, responsibility of manufacturers, complexity in implantation of EPR regulations, modification inbuilt facilities and health and safety issues. Recommendations are made to alleviate these challenges. The outcome of this study could serve as a guideline for designing effective EPR policies.",212165001,51,62,,NUS - Xu
10.1016/j.energy.2023.128201,Evaluating carbon emissions of construction and demolition waste in building energy retrofit projects,"Jianli Hao, Wenting Ma",Energy,2023,(missing abstract),277821644,50,55,,NUS - Xu
10.2139/ssrn.4193537,Benchmarking the Sustainability of Concrete and Steel Modular Construction for Buildings in Urban Development,"W. Pan, Zhiqian Zhang",Social Science Research Network,2023,(missing abstract),276057446,50,2,,NUS - Xu
10.1016/j.autcon.2023.104906,Off-site construction with 3D concrete printing,"Bjorn Ter Haar, Jacques Kruger, Gideon van Zijl",Automation in Construction,2023,(missing abstract),263818759,49,137,,NUS - Xu
