DOI,Title,Authors,Journal,Year,Abstract,LitmapsId,Cited By,References,PubMedId,Tags
10.1016/j.scitotenv.2021.149892,An overview of the waste hierarchy framework for analyzing the circularity in construction and demolition waste management in Europe.,"Chunbo Zhang, Mingming Hu, Francesco Di Maio, Benjamin Sprecher, Xining Yang, Arnold Tukker",Science of the Total Environment,2022,(missing abstract),107780719,385,49,,"NUS - Xu, NUS - Xu Jinying - Transition"
10.1016/j.scitotenv.2021.149892,An overview of the waste hierarchy framework for analyzing the circularity in construction and demolition waste management in Europe.,"Chunbo Zhang, Mingming Hu, Francesco Di Maio, B. Sprecher, Xining Yang, A. Tukker",Science of the Total Environment,2021,(missing abstract),276391910,270,2,,"NUS - Xu, NUS - Xu Jinying - Transition"
10.1016/j.scs.2021.103445,An overview of machine learning applications for smart buildings,"Kari Alanne, Seppo Sierla",Sustainable cities and society,2022,(missing abstract),144945960,230,157,,"NUS - Xu, NUS - Xu Jinying - Transition"
10.1016/j.jclepro.2021.128998,"Big data analytics as a roadmap towards green innovation, competitive advantage and environmental performance","Muhammad Waqas, Xue Honggang, Naveed Ahmad, Syed Abdul Rehman Khan, Muzzafar Iqbal",Journal of Cleaner Production,2021,(missing abstract),225570722,189,84,,"NUS - Xu, NUS - Xu Jinying - Transition"
10.1016/j.jclepro.2020.121458,Research trend of the application of information technologies in construction and demolition waste management,"Clyde Zhengdao Li, Yiyu Zhao, Bing Xiao, Bo Yu, Vivian W.Y. Tam, Zhe Chen, Yingyi Ya",Journal of Cleaner Production,2020,(missing abstract),221446868,156,78,,"NUS - Xu, NUS - Xu Jinying - Transition"
10.36680/j.itcon.2021.027,Towards next generation cyber-physical systems and digital twins for construction,"Abiola Akanmu, Chimay J. Anumba, Omobolanle Ogunseiju",Journal of Information Technology in Construction,2021,"The construction industry continues to seek innovative ways to safely, timely and cost-effectively deliver construction projects. Several efforts have been made to automate construction processes but marginial success has been achieved in effectively reducing the long standing risks suffered by the industry. While industry 4.0 promises to improve project efficiency, reduce waste and improve productivity, the transition to this will depend on the successful adoption of many emerging technologies such as virtual design modeling technologies, sensing technologies, data analysis, storage and communication technologies, human-computer interaction technologies, and robotics. To accelerate innovation, digital twins and cyber-physical systems will be a necessity to advance automation and real-time control with these technologies.  While digital twin represents a digital replica of the asplanned and as-built facility, cyber physical systems involve integration of physical systems with their digital replica through sensors and actuators. Despite evidence of the efficacy of cyber-physical systems and digital twins for reducing non-fatal injuries, enhancing safety management, improving progress monitoring and enhancing performance monitoring and control of facilities, their adoption in the construction industry is still in  its infancy. This paper sheds light on the opportunities offered by cyber-physical systems and digital twins in other industry sectors and advocates for their increased deployment in the construction industry. This paper describes cyber-physical integration of emerging technologies with the physical construction or constructed facility as the next generation digital twin and cyber-physical systems. Potential scenarios of next generation cyber physical system and digital twin for improving workforce productivity, health, and safety, lifecycle management of building systems, and workforce competency are presented.",7185586,147,111,,"NUS - Xu, NUS - Xu Jinying - Transition"
10.1016/j.jclepro.2020.120749,Construction waste minimization in green building: A comparative analysis of LEED-NC 2009 certified projects in the US and China,"Bin Chi, Weisheng Lu, Meng Ye, Zhikang Bao, Xiaoling Zhang",Journal of Cleaner Production,2020,(missing abstract),6068117,143,56,,"NUS - Xu, NUS - Xu Jinying - Transition"
10.1016/j.wasman.2021.08.012,"Estimating construction waste generation in the Greater Bay Area, China using machine learning.","Weisheng Lu, Jinfeng Lou, Chris Webster, Fan Xue, Zhikang Bao, Bin Chi",Waste Management,2021,(missing abstract),183193528,132,84,,"NUS - Xu, NUS - Xu Jinying - Transition"
(missing DOI),Sustainable Cities and Society,"Franco Basso, J. Frez, Hugo Hernández, V. Leiva, Raúl Pezoa, Mauricio Varas",(missing journal),2023,"The emergence of COVID-19 pandemic is causing tremendous impact on our daily lives, including the way people interact with buildings. Leveraging the advances in machine learning and other supporting digital technologies, recent attempts have been sought to establish exciting smart building applications that facilitates better facility management and higher energy efficiency. However, relying on the historical data collected prior to the pandemic, the resulting smart building applications are not necessarily effective under the current ever- changing situation due to the drifts of data distribution. This paper investigates the bidirectional interaction between human and buildings that leads to dramatic change of building performance data distributions post- pandemic, and evaluates the applicability of typical facility management and energy management applications against these changes. According to the evaluation, this paper recommends three mitigation measures to rescue the applications and embedded machine learning algorithms from the data inconsistency issue in the post-pandemic era. Among these measures, incorporating occupancy and behavioural parameters as independent variables in machine learning algorithms is highlighted. Taking a Bayesian perspective, the value of data is exploited, historical or recent, pre- and post-pandemic, under a people-focused view.",264771960,130,133,,"NUS - Xu, NUS - Xu Jinying - Transition"
10.1016/j.jclepro.2022.131335,Circular economy in the construction industry: A review of decision support tools based on Information & Communication Technologies,"Yifei Yu, D. Yazan, Veronica Junjan, M. Iacob",Journal of Cleaner Production,2022,(missing abstract),245532377,122,112,,"NUS - Xu, NUS - Xu Jinying - Transition"
10.1016/j.buildenv.2019.03.050,Evaluating the effects of green building on construction waste management: A comparative study of three green building rating systems,"Weisheng Lu, Bin Chi, Zhikang Bao, Anna Zetkulic",Building and Environment,2019,(missing abstract),18874184,117,31,,"NUS - Xu, NUS - Xu Jinying - Transition"
10.1016/j.rineng.2024.103521,"Emerging Trends in Sustainable Building Materials: Technological Innovations, Enhanced Performance, and Future Directions","Ali Akbar Firoozi, Ali Asghar Firoozi, Damilola Oyejobi, Siva Avudaiappan, Erick Saavedra Flores",Results in Engineering,2024,(missing abstract),281582747,115,254,,"NUS - Xu, NUS - Xu Jinying - Transition"
10.1016/j.jclepro.2022.131423,How to promote the sustainable development of prefabricated residential buildings in China: A tripartite evolutionary game analysis,"Mengqi Yuan, Zhongfu Li, Xiaodong Li, Long Li, Shengxi Zhang, Xiaowei Luo",Journal of Cleaner Production,2022,(missing abstract),206914556,115,63,,"NUS - Xu, NUS - Xu Jinying - Transition"
10.36680/j.itcon.2021.027,Towards next generation cyber-physical systems and digital twins for construction,"A. Akanmu, C. Anumba, Omobolanle O. Ogunseiju",Journal of Information Technology in Construction,2021,"The construction industry continues to seek innovative ways to safely, timely and cost-effectively deliver construction projects. Several efforts have been made to automate construction processes but marginial success has been achieved in effectively reducing the long standing risks suffered by the industry. While industry 4.0 promises to improve project efficiency, reduce waste and improve productivity, the transition to this will depend on the successful adoption of many emerging technologies such as virtual design modeling technologies, sensing technologies, data analysis, storage and communication technologies, human-computer interaction technologies, and robotics. To accelerate innovation, digital twins and cyber-physical systems will be a necessity to advance automation and real-time control with these technologies. While digital twin represents a digital replica of the asplanned and as-built facility, cyber physical systems involve integration of physical systems with their digital replica through sensors and actuators. Despite evidence of the efficacy of cyber-physical systems and digital twins for reducing non-fatal injuries, enhancing safety management, improving progress monitoring and enhancing performance monitoring and control of facilities, their adoption in the construction industry is still in its infancy. This paper sheds light on the opportunities offered by cyber-physical systems and digital twins in other industry sectors and advocates for their increased deployment in the construction industry. This paper describes cyber-physical integration of emerging technologies with the physical construction or constructed facility as the next generation digital twin and cyber-physical systems. Potential scenarios of next generation cyber physical system and digital twin for improving workforce productivity, health, and safety, lifecycle management of building systems, and workforce competency are presented.",275980904,115,4,,"NUS - Xu, NUS - Xu Jinying - Transition"
10.3390/buildings13020441,BIM and Digital Twin for Developing Convergence Technologies as Future of Digital Construction,"S. Sepasgozar, A. Khan, K. Smith, Juan Sebastian Garzon Romero, Xiaohan Shen, S. Shirowzhan, Heng Li, F. Tahmasebinia",Buildings,2023,"The construction industry is slow to adopt new technologies. The implementation of digital technologies and remote operations using robots were considered farfetched affairs and unbelievable approaches. However, the effect of COVID-19 on clients and construction companies put high pressure on construction managers to seek digital solutions and justified the need for remote operating or distant controlling technologies. This paper aims to investigate the state of play in construction technology implementation and presents a roadmap for developing and implementing required technologies for the construction industry. The COVID-19 disruption required new methods of working safely and remotely and coincided with the advent of advanced automation and autonomous technologies. This paper aims to identify gaps and 11 disruptive technologies that may lead to upheaval and transformation of the construction sector, perhaps in this decade. A road map for technology implementation can be helpful in developing business strategies at the organizational level as a theoretical measure, and it can facilitate the technology implementation process at the industry level as a practical measure. The roadmap can be used as a framework for policymakers to set industry or company strategies for the next 10 years (2030).",253853590,112,129,,"NUS - Xu, NUS - Xu Jinying - Transition"
10.1016/j.compind.2021.103437,Two-layer Adaptive Blockchain-based Supervision model for off-site modular housing production,"Xiao Li, Liupengfei Wu, Rui Zhao, Weisheng Lu, Fan Xue",Computers in industry (Print),2021,(missing abstract),21065863,111,58,,NUS - Xu
10.1016/j.resconrec.2022.106667,Applicability of the environmental Kuznets curve to construction waste management: A panel analysis of 27 European economies,"Zhikang Bao, Weisheng Lu, Zhikang Bao, Weisheng Lu","Resources, Conservation and Recycling",2023,(missing abstract),255172513,106,79,,NUS - Xu
10.1007/s11356-021-12739-7,A comprehensive review on green buildings research: bibliometric analysis during 1998–2018,"Ying Li, Yanyu Rong, Umme Marium Ahmad, Xiaotong Wang, Jian Zuo, Guozhu Mao",Environmental science and pollution research international,2021,"Buildings account for nearly 2/5ths of global energy expenditure. Due to this figure, the 90s witnessed the rise of green buildings (GBs) that were designed with the purpose of lowering the demand for energy, water, and materials resources while enhancing environmental protection efforts and human well-being over time. This paper examines recent studies and technologies related to the design, construction, and overall operation of GBs and determines potential future research directions in this area of study. This global review of green building development in the last two decades is conducted through bibliometric analysis on the Web of Science, via the Science Citation Index and Social Sciences Citation Index databases. Publication performance, countries' characteristics, and identification of key areas of green building development and popular technologies were conducted via social network analysis, big data method, and S-curve predictions. A total of 5246 articles were evaluated on the basis of subject categories, journals' performance, general publication outputs, and other publication characteristics. Further analysis was made on dominant issues through keyword co-occurrence, green building technologies by patent analysis, and S-curve predictions. The USA, China, and the UK are ranked the top three countries where the majority of publications come from. Australia and China had the closest relationship in the global network cooperation. Global trends of the top 5 countries showed different country characteristics. China had a steady and consistent growth in green building publications each year. The total publications on different cities had a high correlation with cities' GDP by Baidu Search Index. Also, barriers and contradictions such as cost, occupant comfort, and energy consumption were discussed in developed and developing countries. Green buildings, sustainability, and energy efficiency were the top three hotspots identified through the whole research period by the cluster analysis. Additionally, green building energy technologies, including building structures, materials, and energy systems, were the most prevalent technologies of interest determined by the Derwent Innovations Index prediction analysis. This review reveals hotspots and emerging trends in green building research and development and suggests routes for future research. Bibliometric analysis, combined with other useful tools, can quantitatively measure research activities from the past and present, thus bridging the historical gap and predicting the future of green building development.",47831500,102,84,,NUS - Xu
10.3390/buildings12101503,"Internet of Things (IoT), Building Information Modeling (BIM), and Digital Twin (DT) in Construction Industry: A Review, Bibliometric, and Network Analysis","Milad Baghalzadeh Shishehgarkhaneh, Afram Keivani, Robert Moehler, None Arash Jelodari, Sevda Roshdi Laleh, Milad Baghalzadeh Shishehgarkhaneh, Afram Keivani, Robert Moehler, None Arash Jelodari, Sevda Roshdi Laleh",Buildings,2022,"The present study uses a bibliometric and systematic literature review (SLR) to examine the use of Building Information Modeling (BIM), the Internet of Things (IoT), and Digital Twins (DT) in the construction industry. The network visualization and other approaches based on the Web of Science (WOS) database and the patterns of research interactions were explored in 1879 academic publications using co-occurrence and co-citation investigations. Significant publications, conferences, influential authors, countries, organizations, and funding agencies have been recognized. Our study demonstrates that BIM, IoT, and DT in construction, Heritage BIM (HBIM), Smart Contracts, BIM, and Ontology, and VR and AR in BIM and DT are the main study themes. Finally, several prospective areas for future study are identified, including BIM and Metaverse technology, BIM and Artificial Intelligence (AI), Metaheuristic algorithms for optimization purposes in BIM, and the Circular Economy with BIM and IoT.",251699643,99,95,,NUS - Xu
10.1016/j.jenvman.2022.117170,"Air pollution, water pollution, and robots: Is technology the panacea.","Jian Song, Yang Chen, Fushu Luan, Jian Song, Yang Chen, Fushu Luan",Journal of Environmental Management,2023,(missing abstract),250800146,97,60,,NUS - Xu
10.1016/j.scs.2021.102804,Does historical data still count? Exploring the applicability of smart building applications in the post-pandemic period,"Xiang Xie, Qiuchen Lu, Manuel Herrera, Qiaojun Yu, Ajith Kumar Parlikad, Jennifer Schooling",Sustainable cities and society,2021,(missing abstract),27923173,94,101,,NUS - Xu
10.1016/j.eiar.2019.106283,Empowering impact assessments knowledge and international research collaboration - A bibliometric analysis of Environmental Impact Assessment Review journal,Andreea Nita,Environmental impact assessment review,2019,(missing abstract),91232549,92,94,,NUS - Xu
10.1016/j.techsoc.2024.102519,Infrastructure digital twin technology: A new paradigm for future construction industry,"T. Moshood, James OB. Rotimi, Wajiha Shahzad, J. Bamgbade",Technology and Society,2024,(missing abstract),272578143,92,128,,NUS - Xu
10.1016/j.autcon.2021.104015,Integrated BIM and DfMA parametric and algorithmic design based collaboration for supporting client engagement within offsite construction,"Sajjad Bakhshi, Mohammad Reza Chenaghlou, Farzad Pour Rahimian, David J. Edwards, Nashwan Dawood",Automation in Construction,2022,(missing abstract),26209599,91,88,,NUS - Xu
10.1155/2021/8811476,Adopting Building Information Modeling (BIM) for the Development of Smart Buildings: A Review of Enabling Applications and Challenges,"A. Yang, Mingzhe Han, Qingcheng Zeng, Yuhui Sun",(missing journal),2021,"The construction industry is undergoing a digital revolution due to the emergence of new technologies. A significant trend is that construction projects have been transformed and upgraded to the digital and smart mode in the whole life cycle. As a critical technology for the construction industry’s innovative development, building information modeling (BIM) is widely adopted in building design, construction, and operation. BIM has gained much interest in the research field of smart buildings in recent years. However, the dimensions of BIM and smart building applications have not been explored thoroughly so far. With an in-depth review of related journal articles published from 1996 to July 2020 on the BIM applications for smart buildings, this paper provides a comprehensive understanding and critical thinking about the nexus of BIM and smart buildings. This paper proposes a framework with three dimensions for the nexus of BIM application in smart buildings, including BIM attributes, project phases, and smart attributes. According to the three dimensions, this paper elaborates on (1) the advantages of BIM for achieving various smartness; (2) applications of BIM in multiple phases of smart buildings; and (3) smart building functions that be achieved with BIM. Based on the analysis of the literature in three dimensions, this paper presents the cross-analysis of the nexus of BIM and smart buildings. Lastly, this paper proposes the critical insights and implications about the research gaps and research trends: (1) enhancing the interoperability of BIM software; (2) further exploring the role of BIM in the operation and refurbishment phase of smart buildings; (3) paying attention to BIM technology in the field of transportation infrastructure; (4) clarifying the economic benefits of BIM projects; and (5) integrating BIM and other technologies.",122754541,91,107,,NUS - Xu
10.1016/j.jclepro.2023.136840,Investigating the barriers to the adoption of blockchain technology in sustainable construction projects,"Atul Kumar Singh, V.R. Prasath Kumar, Gholamreza Dehdasht, S. R. Mohandes, P. Manu, F. Rahimian",Journal of Cleaner Production,2023,(missing abstract),255348966,91,115,,NUS - Xu
10.1016/j.buildenv.2022.109260,A systematic review of the integration of building information modeling into life cycle assessment,"Yue Teng, Jiayi Xu, Wei Pan, Yang Zhang, Yue Teng, Jiayi Xu, Wei Pan, Yang Zhang",Building and Environment,2022,(missing abstract),92393101,90,81,,NUS - Xu
10.1108/sasbe-08-2020-0115,"Exploring applicability, interoperability and integrability of Blockchain-based digital twins for asset life cycle management","Christopher Santi Götz, P. Karlsson, I. Yitmen",Smart and Sustainable Built Environment,2020,"PurposeThe blockchain-based digital twin has been recognized as a prominent technological ecosystem featuring synergies with both established and emergent information management practice. The purpose of this research is to explore the applicability, interoperability and integrability of a blockchain-based digital twin for asset life cycle management and develop a model of framework which positions the digital twin within a broader context of current management practice and technological availability.Design/methodology/approachA systematic literature review was performed to map use cases of digital twin, IoT, blockchain and smart contract technologies. Surveys of industry professionals and analyses were conducted focussing on the mapped use cases' life cycle–centric applicability, interoperability and integrability with current asset life cycle management practice, exploring decision support capabilities and industry insights. Lastly, a model of framework was developed based on the use case, interoperability and integrability findings.FindingsThe results support approaching digitization initiatives with blockchain-based digital twins and the positioning of the concept as both a strategic tool and a multifunctional on-field support application. Integrability enablers include progression towards BIM level 3, decentralized program hubs, modular cross-technological platform interfaces, as well as mergeable and scalable blockchains.Practical implicationsKnowledge of use cases help highlight the functionality of an integrated technological ecosystem and its connection to comprehensive sets of asset life cycle management aspects. Exploring integrability enablers contribute to the development of management practice and solution development as user expectations and technological prerequisites are interlinked.Originality/valueThe research explores asset life cycle management use cases, interoperability and integrability enablers of blockchain-based digital twins and positions the technological ecosystem within current practice and technological availability.",53283947,88,80,,NUS - Xu
